{
  "operation_id": "op_01",
  "object_id": "poi_01",
  "object_type": "poi",
  "action": "create",
  "client_time": "2026-10-02T00:00:00Z",
  "base_version": 0,
  "payload": {
    "id": "poi_01",
    "event_id": "evt_demo",
    "kind": "observation",
    "label": "Point observé",
    "lat": 48.8,
    "lon": 2.1,
    "created_at": "2026-10-02T00:00:00Z"
  },
  "retry_count": 0
}